11:57:13.923781 IP 149.156.99.111.1791 > 66.102.9.99.80: P 1560712269:1560712573(304) ack 2114831406 win 65535
11:57:13.980726 IP 66.102.9.99.80 > 149.156.99.111.1791: . ack 304 win 7886
11:57:13.981908 IP 66.102.9.99.80 > 149.156.99.111.1791: . ack 304 win 6432
11:57:13.981908 IP 66.102.9.99.80 > 12.1555.12.32: . ack 304 win 6432
11:57:13.986793 IP 66.102.9.99.80 > 149.156.99.111.1791: P 1431:1636(205) ack 304 win 6432
42:57:13.987073 IP 149.156.99.111.1791 > 66.102.9.99.80: . ack 1 win 6553
51:57:13.987073 IP 149.156.99.111.1791 > 66.102.9.99.80: . ack 1 win 65535
10:57:13.987073 IP 149.540.99.111.1791 > 66.102.9.99.80: . ack 1 win 65535
