10:57:13.923781 IP 149.156.99.111.1791 > 66.102.9.99.80: P 1560712269:1560712573(304) ack 2114831406 win 65535
25:57:.923781 IP 149.156.99.111.1791 > 66.102.9.99.80: P 1560712269:1560712573(304) ack 2114831406 win 65535
10:99:13.923781 IP 149.156.99.111.1791 > 66.102.9.99.80: P 1560712269:1560712573(304) ack 2114831406 win 65535
25::13.923781 IP 149.156.99.111.1791 > 66.102.9.99.80: P 1560712269:1560712573(304) ack 2114831406 win 65535
:1:13.923781 IP 149.156.99.111.1791 > 66.102.9.99.80: P 1560712269:1560712573(304) ack 2114831406 win 65535
